{
  "actor": {
    "id": "openai-gpt-5.5-opencode",
    "kind": "agent"
  },
  "candidate_commit": "1979ed53a092e3068642325534ab2b04e1747145",
  "checks": [
    {
      "evidence": "Docker py_compile passed; tests/release_gate 32 passed; canary worker image built and runs as UID 10001; Free and Pro verify_release_canary_guards() returned true.",
      "id": "implementation-tests",
      "status": "PASS"
    }
  ],
  "created_at": "2026-07-20T02:12:02.276264+00:00",
  "event": "DEVELOPER_SUBMIT",
  "findings": [],
  "handoff": {
    "reason": "Review isolated canary release package before certification.",
    "to_role": "qa-test-engineer"
  },
  "provenance": {
    "artifact_file": null,
    "artifact_name": null,
    "commit": null,
    "repository": "romelhc95/studiamatch",
    "run_id": null,
    "source": "opencode",
    "workflow": null
  },
  "release_id": "pre-hito1-hardening",
  "revision": 1,
  "role": "developer",
  "schema_version": 1,
  "sequence": 1,
  "verdict": "PASS"
}
