{
  "actor": {
    "id": "supabase-architect-gpt-5.5-opencode",
    "kind": "agent"
  },
  "candidate_commit": "1979ed53a092e3068642325534ab2b04e1747145",
  "checks": [
    {
      "evidence": "Reviewed remediation diff: only developer-submit candidate_commit and release-manifest candidate_commit/evidence checksum changed. HEAD and origin/desarrollo both resolve to 1979ed53a092e3068642325534ab2b04e1747145. Manifest SHA256 entries for developer-submit and both canary migrations match local files. Canary migrations are versioned, transactional, target Free+Pro, and current remediation introduces no new DDL/data mutation.",
      "id": "schema-review",
      "status": "PASS"
    },
    {
      "evidence": "Reviewed canary SQL: RLS is enabled on exposed public tables touched by canary scope; anon/authenticated receive restrictive SELECT exclusion policies for reserved canary slugs/URLs; canary_runner is NOLOGIN/NOBYPASSRLS, select-only on required tables, no DML/table elevated grants; SECURITY DEFINER canary RPCs revoke PUBLIC/anon/authenticated and grant EXECUTE only to service_role/canary_runner with search_path pinned.",
      "id": "rls-review",
      "status": "PASS"
    }
  ],
  "created_at": "2026-07-20T16:12:00Z",
  "event": "DATABASE_PASS",
  "findings": [],
  "handoff": {
    "reason": "Database/schema/RLS review passes for metadata-only remediation after security; proceed to pipeline validation.",
    "to_role": "pipeline-engineer"
  },
  "provenance": {
    "artifact_file": null,
    "artifact_name": null,
    "commit": null,
    "repository": "romelhc95/studiamatch",
    "run_id": null,
    "source": "opencode",
    "workflow": null
  },
  "release_id": "pre-hito1-hardening",
  "revision": 1,
  "role": "supabase-architect",
  "schema_version": 1,
  "sequence": 4,
  "verdict": "PASS"
}
