{
  "actor": {
    "id": "openai-gpt-5.5-opencode-pipeline-engineer",
    "kind": "agent"
  },
  "candidate_commit": "1979ed53a092e3068642325534ab2b04e1747145",
  "checks": [
    {
      "evidence": "Static pipeline review passed for candidate 1979ed53a092e3068642325534ab2b04e1747145: manifest/evidence metadata aligned; canary workflow uses isolated candidate checkout, canary_runner access token, scoped workers, atomic RPC fail-closed flags, production_enabled=false canary sync, mock-only enrichment, cleanup rehearsal, and out-of-scope mutation checks.",
      "id": "pipeline-tests",
      "status": "PASS"
    }
  ],
  "created_at": "2026-07-20T16:13:00Z",
  "event": "PIPELINE_PASS",
  "findings": [],
  "handoff": {
    "reason": "Pipeline gate is acceptable after DATABASE_PASS/DATABASE_VALIDATED; proceed to writers pause orchestration.",
    "to_role": "devops-release-manager"
  },
  "provenance": {
    "artifact_file": null,
    "artifact_name": null,
    "commit": null,
    "repository": "romelhc95/studiamatch",
    "run_id": null,
    "source": "opencode",
    "workflow": null
  },
  "release_id": "pre-hito1-hardening",
  "revision": 1,
  "role": "pipeline-engineer",
  "schema_version": 1,
  "sequence": 5,
  "verdict": "PASS"
}
